{
  "schema_version": "1.0.0",
  "id": "learning-platform-operations-migration-readiness",
  "title": "LMS Migration Experience",
  "slug": "learning-platform-operations-migration-readiness",
  "category": "lms-administration",
  "subcategory": null,
  "status": "live",
  "summary": "I helped configure and test the Absorb-to-Docebo migration, then continued with administrator training, learner support, guidance, and reporting.",
  "page_path": "portfolio/projects/lms-administration/learning-platform-operations-migration-readiness/index.html",
  "featured": true,
  "confidentiality": "sanitized",
  "content": {
    "business_need": "Move learning operations from Absorb into Docebo while rebuilding the structures, content relationships, learning plans, certifications, support processes, and reporting needed for employees, partners, and customers.",
    "audience": "Employees, partners, customers, and learning operations teams.",
    "learning_objectives": [
      "Configure and validate learning structures, content, learning plans, catalogs, and certifications in Docebo.",
      "Test employee, partner, and customer learner journeys before and around launch.",
      "Document migration issues, retest fixes, and support learner-facing troubleshooting.",
      "Build repeatable support and documentation workflows and support immediate post-launch reporting and action planning."
    ],
    "role": "Instructional designer and LMS content administrator supporting configuration, UAT, administrator training, learner support, documentation, and post-launch reporting within the migration team.",
    "design_approach": "I treated the Absorb environment as a source of learner routes and decision history, not just a file collection. Course and enrollment crosswalks, destination relationships, persona testing, and exception review connected instructional design to Docebo administration.",
    "development_process": "I reviewed courses and relationships in Absorb, helped map them into Docebo, configured content and learning plans, tested learner routes, documented and retested issues, and created learner and administrator guidance. After launch, I continued supporting administrators and users and developing Power BI dashboards using LMS and Snowflake-connected reporting data.",
    "outcomes": [
      "Helped map, configure, and validate Docebo learning structures, plans, content, certifications, and audience experiences.",
      "Documented migration issues and supported triage and retesting across employee, partner, and customer journeys.",
      "Continued post-launch support through administrator training, learner guidance, issue follow-up, and Power BI reporting."
    ]
  },
  "detail_sections": [
    {
      "id": "setup-configuration",
      "eyebrow": "Setup + Configuration",
      "title": "What I helped build in Docebo.",
      "summary": "My migration work included configuring the learning structures and content relationships that learners would use after launch.",
      "layout": "cards",
      "items": [
        {"title": "Learning structures", "body": "Helped set up learning plans, catalogs, content relationships, and learner-facing organization in Docebo.", "tag": "Setup"},
        {"title": "Certifications + access", "body": "Worked with certifications, renewals, audience visibility, and related learner-path configuration.", "tag": "Configuration"},
        {"title": "Content", "body": "Configured and validated migrated course content and learner-facing assets against the existing Absorb environment.", "tag": "Content"}
      ]
    },
    {
      "id": "uat-validation",
      "eyebrow": "UAT + Validation",
      "title": "What I tested before and around launch.",
      "summary": "I checked learner-facing behavior and the platform structures behind it across different audience types.",
      "layout": "cards",
      "items": [
        {"title": "Audience visibility", "body": "Tested employee, partner, and customer experiences and checked whether the right content appeared to the right audiences.", "tag": "Access"},
        {"title": "Learning plans", "body": "Validated plan structure, sequencing, content relationships, and learner-facing behavior.", "tag": "Pathways"},
        {"title": "Certifications + renewals", "body": "Tested certification workflows and renewal paths for new and returning learners.", "tag": "Certification"},
        {"title": "Content + navigation", "body": "Validated migrated content, thumbnails, navigation, catalogs, links, and learner guidance.", "tag": "Experience"},
        {"title": "Issue triage", "body": "Documented problems, supported troubleshooting, and retested fixes as issues moved toward resolution.", "tag": "QA"}
      ]
    },
    {
      "id": "support-operations",
      "eyebrow": "Support + Operations",
      "title": "How I support the system after launch.",
      "summary": "I help administrators and learners use the new environment, resolve issues, and review learning data.",
      "layout": "cards",
      "items": [
        {"title": "Learner support", "body": "Troubleshoot learner and customer issues and use repeat questions to improve guidance.", "tag": "Support"},
        {"title": "Administrator training", "body": "Create navigation videos, user guides, reporting instructions, and train-the-trainer resources.", "tag": "Training"},
        {"title": "Reporting", "body": "Build Power BI dashboards and review LMS records alongside Snowflake-connected reporting data.", "tag": "Analytics"}
      ]
    },
    {
      "id": "evidence-boundaries",
      "eyebrow": "Evidence",
      "title": "My migration contribution.",
      "summary": "This case reflects work I directly completed or supported at the learning-content, learner-experience, and LMS-operations layer.",
      "layout": "cards",
      "items": [
        {"title": "Setup + configuration", "body": "Learning structures, learning plans, content, catalogs, certifications, and learner-facing relationships in Docebo.", "tag": "Supported"},
        {"title": "UAT + support", "body": "Learner-journey testing, issue documentation, retesting, inbox support, and learner guidance.", "tag": "Supported"},
        {"title": "Post-launch operations", "body": "Administrator training, learner guidance, issue follow-up, Power BI dashboards, and reporting review.", "tag": "Supported"}
      ]
    }
  ],
  "related_work": [
    {"project_id": "enterprise-sales-certification", "relationship": "Learning-path implementation, certification behavior, and LMS administration"},
    {"project_id": "certification-reporting-automation", "relationship": "LMS reporting, completion analysis, and operational review"}
  ],
  "skills": ["LMS Administration", "User Acceptance Testing", "LMS Migration", "Learning Plan Configuration", "Content Governance", "Learner Experience", "Certification Workflows", "Learner Support", "Documentation", "Reporting", "Launch Readiness", "Administrator Training", "Power BI", "Learning Analytics"],
  "tools": ["Absorb LMS", "Docebo LMS", "Articulate Rise 360", "xAPI / SCORM", "Microsoft 365", "Power BI", "Snowflake"],
  "assets": [
      {
          "type": "image",
          "path": "portfolio/assets/project-images/lms-migration/learner-home.webp",
          "alt": "Fictional LMS learner home with assignments, progress, and support.",
          "caption": "Representative reconstruction; all names, numbers, and interface details are illustrative.",
          "publish": true
      },
      {
          "type": "image",
          "path": "portfolio/assets/project-images/lms-migration/course-player.webp",
          "alt": "Fictional LMS course player with a knowledge check.",
          "caption": "Representative reconstruction; all names, numbers, and interface details are illustrative.",
          "publish": true
      },
      {
          "type": "image",
          "path": "portfolio/assets/project-images/lms-migration/admin-dashboard.webp",
          "alt": "Fictional LMS admin dashboard with illustrative activity and enrollment data.",
          "caption": "Representative reconstruction; all names, numbers, and interface details are illustrative.",
          "publish": true
      },
      {
          "type": "image",
          "path": "portfolio/assets/project-images/lms-migration/learning-pathway.webp",
          "alt": "Illustrative learning pathway with required modules, optional practice, and assessment.",
          "caption": "Representative reconstruction; all names, numbers, and interface details are illustrative.",
          "publish": true
      }
  ],
  "source_material_notes": "Generalized from completed LMS migration and launch-support work moving learning operations from Absorb LMS into Docebo LMS. Internal configurations, learner records, issue logs, credentials, proprietary screenshots, implementation details, and company-specific terminology are intentionally omitted. Public interface visuals and the learner-route simulator are representative reconstructions. Sample names, numbers, and UAT scenarios are illustrative, not production screenshots, actual results, or historical issue records.",
  "dates": {"created": "2026-09-15", "updated": "2026-10-07"}
}
