{
  "schema_version": "1.0.0",
  "id": "product-launch-microlearning",
  "title": "Product Launch Microlearning",
  "slug": "product-launch-microlearning",
  "category": "instructional-design",
  "subcategory": "microlearning",
  "status": "live",
  "summary": "A sales-enablement case study built as a concise Rise overview and a separate Storyline scenario, shown through a public-safe DraftPath informational lesson.",
  "page_path": "portfolio/projects/instructional-design/microlearning-performance-support/product-launch-microlearning/index.html",
  "featured": true,
  "confidentiality": "sanitized",
  "content": {
    "business_need": "Give sellers enough launch context to explain a new offer and recognize customer fit without turning a focused product introduction into a full certification course.",
    "audience": "Internal sellers and channel partners who need quick launch readiness before customer conversations.",
    "learning_objectives": [
      "Explain the customer problem and product value at a sales-ready level.",
      "Recognize common situations where the offer may fit.",
      "Practice choosing an appropriate customer-facing response or next step.",
      "Use supporting launch resources without memorizing unnecessary detail."
    ],
    "role": "Instructional designer and developer responsible for learning structure, scenario design, build, review coordination, and revision.",
    "design_approach": "Separate context from practice instead of compressing everything into one long module. Use the short overview for positioning and use cases, then give sellers a focused scenario where choices and explanatory feedback rehearse the customer conversation.",
    "development_process": "Translated approved launch and product-marketing material into a Rise overview and a separate Storyline practice experience, then coordinated internal QA and SME review through Review 360 and Asana. Revisions focused on instructions, readability, navigation, feedback, and completion messaging.",
    "outcomes": [
      "Delivered a paired learn-then-practice experience rather than an oversized launch course.",
      "Used scenario decisions and explanatory feedback to move beyond passive product review.",
      "Kept the two assets modular so positioning content and practice could be revised independently as launch guidance changed."
    ]
  },
  "skills": [
    "Microlearning",
    "Sales Enablement",
    "Scenario-Based Learning",
    "eLearning Design",
    "Instructional Design",
    "SME Collaboration",
    "QA",
    "Performance Support"
  ],
  "tools": [
    "Articulate Rise 360",
    "Articulate Storyline 360",
    "Articulate Review 360",
    "Asana"
  ],
  "assets": [],
  "source_material_notes": "Generalized from documented product-launch enablement work. Product names, launch messaging, internal screenshots, customer details, reviewer comments, dates, links, and proprietary source material are intentionally omitted.",
  "dates": {
    "created": "2026-09-16",
    "updated": "2026-09-22"
  }
}
